symbol,company_name,headline,news_source,published_at,url,summary,overall_sentiment_score,overall_sentiment_label,symbol_sentiment_score,symbol_relevance_score,symbol_sentiment_label,api_source,ingestion_timestamp
AAPL,Apple Inc,Apple shares rise after positive analyst outlook,Reuters,2026-06-11 08:15:00,https://example.com/aapl-1,Analysts raised their outlook for Apple based on stronger product demand.,0.45,Bullish,0.62,0.88,Bullish,sample,2026-06-11 09:40:00
AAPL,Apple Inc,Apple announces new AI features for devices,Nasdaq,2026-06-11 07:45:00,https://example.com/aapl-2,Apple announced new AI-related software features that may support investor confidence.,0.38,Bullish,0.55,0.79,Bullish,sample,2026-06-11 09:40:00
MSFT,Microsoft Corporation,Microsoft opens lower as technology stocks weaken,CNBC,2026-06-11 08:20:00,https://example.com/msft-1,Microsoft traded lower in premarket activity as broader technology stocks showed weakness.,-0.22,Bearish,-0.31,0.82,Bearish,sample,2026-06-11 09:40:00
MSFT,Microsoft Corporation,Cloud growth concerns pressure Microsoft shares,MarketWatch,2026-06-11 08:05:00,https://example.com/msft-2,Investors reacted cautiously to comments around enterprise cloud spending trends.,-0.18,Bearish,-0.25,0.76,Bearish,sample,2026-06-11 09:40:00
NVDA,NVIDIA Corporation,Nvidia gains as AI chip demand remains strong,Bloomberg,2026-06-11 08:10:00,https://example.com/nvda-1,Nvidia shares moved higher as market sentiment around AI chip demand stayed positive.,0.52,Bullish,0.71,0.91,Bullish,sample,2026-06-11 09:40:00
NVDA,NVIDIA Corporation,Semiconductor stocks rise on positive AI infrastructure outlook,Reuters,2026-06-11 07:55:00,https://example.com/nvda-2,Chipmakers gained after positive commentary around AI infrastructure investments.,0.41,Bullish,0.63,0.84,Bullish,sample,2026-06-11 09:40:00
